Gondi Sentence	Hindi Translation	Telugu Translation
ताडी मरातल पेय्‍सना कल्‍दुन ताडी कल इंतुर.	ताड़ी के पेड़ से जो मद्य निकलता है, उसे ताड़ी कहते है।	
ताडी मरातल पेय्‍सना कल्‍दुन ताडी कल इंतुर.	ताड़ी के पेड़ से जो मद्य निकलता है, उसे ताड़ी कहते है।	
यावना बाबन तातल इंतुर.	माँ के पिताजी को दादाजी कहते है।	
गंगा बेरेड्ते एक्‍को तांबेल्‍क मनंतां.	गंगा नदी में सबसे ज्यादा कच्‍छुए पाये जाते है।	గంగా యందు నీటిలో తాంబేలుఎక్కువగ ఉంటాయి.
तालम कय होननय्ते तालमतुन पैहा पींता.	ताला की किल्‍ली गूम हुई तो ताले को तोडना पडेगा।	
बॆकेनना होत्ते लोतुक तालम डब्‍बा वाटसि होनना.	कहीं जाते समय घर को ताला लगाके जानी चाहीये।	
बॆकेनना होत्ते लोतुक तालम डब्‍बा वाटसि होनना.	कहीं जाते समय घर को ताला लगाके जानी चाहीये।	
तालीते एर मुड़हाचि उंटुर.	लोटे से पानी पीते है।	
ताल्‍प वाटता पेरगु एक्‍को मरमींने तिंतुर.	शादींयों में अधिक मात्र से कड़ी का उपयोग होता है।	
गंजुना एर कास्‍तनो हिल्‍लेनो तेडियला गंजुंना एतुन कय ताससि हुळगोम.	गंज का पानी गरम हुआ की नही, जानने के लिये उसे हाथ लगाके देखनी चाहीये।	
गुदुमसाइ एगरनेंके तासे तनांतुर.	'गुदुमसाइ' नृत्य करते समय यह ताशा बजाया जाता है।	గుదుమ్సాయ్ నృత్యం చేసెటప్పడు (వెట్టే) అనే సంగీత సాధనం వాయిస్తారు.
तिना कय्‍दे गाटो तिंतुर.	दाहिना हाथ से खाना खाते है।	
मावा लॊता तिनेर्गुंक मा मामाना लॊन मंता.	हमारे घर के दाहिने ओर मेरे मामा का मकान है।	
नाकु तिना कय्‍दे वेल्‍ले कबह्‍क कियावांतां.	मै दाहिना हाथ से ज्यादा काम करता हूँ।	
नाकु तिना कय्‍दे वेल्‍ले कबह्‍क कियावांतां.	मै दाहिना हाथ से ज्यादा काम करता हूँ।	
इरगा ताकत वायगोम इत्ते इरगा गाटो तिनमड़ गावाले.	ताकतवार बनने के लिये ज्यादा खाना खानी चाहीये।	
मावा लॊता तिनेर्गुंक मा मामाना लॊन मंता.	हमारे घर के दाहिने ओर मेरे मामा का मकान है।	
वेल्‍लेसेपु उद्दिसि मत्ते काल्‍कु तिम्मिरि पींतां.		చాల సేపు కూర్చుంటే కాలకు తిమ్మిరి ఎక్కుతాయి.
सेक्‍करा तिय्यगा मनंता.	शक्‍कर मिठा होता है।	
नाकु उत्तगा तिरयुड इत्ते इस्‍टम हिल्‍ले.	मुझे बेवजह घूमना पसंद नही है।	
नॆदे जोन्ना विसला कोंदां दोहचि बंती तिरहंतुर.		ఎడ్లను జొన్నచెలిలో కట్టి బంతి తింపుతారు.
नॆदे जोन्ना विसला कोंदां दोहचि बंती तिरहंतुर.		ఎడ్లను జొన్నచెలిలో కట్టి బంతి తింపుతారు.
नाकू कट्टे नर्कनेंके कादुक मर्सु तिवता.	लकडीयाँ तोड़ते समय मेरा पांव कट गया।	
सिन्ने पिलाल्‍कुंक गाटो तिहमड़ गावाले.	छोटे बच्‍चों को खाना खिलानी चाहिये।	
करंट ई लॊताल आ लॊतुक होनला तीगे हहा पींता.	बिजली इस घर से उस घर जाने के लिये वायर लगाना पडता है।	
पिट्टे बचूंगों तीर्कुनां मनंता.	पंछीयाँ अलग-अलग प्रकार के होते है।	
मरमींने रकारकाल्‍कुना गाटों अट्टंतुर.	शादीयों मे तरह-तरह के पकवान पकाते है।	పెండ్లిలో రకరకాలు వంటకాలు చేస్తారు.
गाटो अट्टकामुन्ने परिक तीर्पगोम.	खाना पकाने से पहले चावल चुननी चाहिये।	
तुंगा जाडी दोय्यने एक्‍को पुट्टंता.	यह घास खेतों में अधिक मात्रा से उगता है।	
तुम्मिर आकीन बीडीं कींतुर.	तेंदु पत्ता का बीड़ी बनाते है।	తునికి ఆకులతో బీడీలు తయారు చేస్తారు.
पाकीस्‍तान देसेमते तुरकलोर एक्‍को मंतुर.	पाकीस्‍तान में मुसलमानो की जनसंख्या अधिक है।	
हिंदु दर्मातोर तुलसे मराता पूजे कींतुर.	सारे हिंदू धर्मी तुलसी के पूजा करते है।	హిందువులు స్నానం చేసి తుల్సి మొక్కను (చెట్టును) రోజు పూజిస్తారు.
एर तुंगतंका तुवेलाते उसुमकुंतुर.	नहाने के बाद तौलिया से पोंछ लेते है।	
पड़सेम पीते बागा तुहका वांता.		జలబు అయితే తుమ్ములు వస్తాయి.
नना तल्‍पुना गोल्‍लेम तेंडतन.	मैने दरवाजा खोला है।	నేను తలుపు తీస్తున్నాను.
ओर इन तनला तेदतोर.	वो इसे मारने के लिये तयार हो गया था।	ఈయన ఆయనను కొట్టడానికి తెగించాడు.
बुक्‍कुना कायदोम तेल्‍लगा मनंता.		నోటు పుస్తకములోని కమ్మలు తెల్లగ ఉంటాయి.
तेल्‍ला गड्डा गाटोतोन तिंतुर.	यह मुली भोजन के साथ खाते है।	
हापां आयीं मिर्सां आयीं तोटाते पंडिचंतुर.	बैंगन हो या मिर्ची अलग बागिचे में लगाते है।	వంకాయలు, మిర్చి, తోటలో పండిస్తారు.
तोडेल्‍ली केडाते मंचि मक्‍किसि एटिन पींता.		తోడేలు అడవిలో ఉంటుంది మేకలను వేటాడి తింటుంది.
मीन्‍क पियला बाईह्‍क एतुन तोरसंतां.		మహిలలు (స్త్రీ) చేపలు పట్టడానికి వాగు నీళ్ళను తోడుతారు.
अरटि पंडि तितंका दाना तोलून पोचिंतुर.	केला खाने के बाद उसका चिल्टा फेंक देते है।	అరటి పండు తిని తొక్క పారెస్తారు.
रोज हक्‍केर्कु एरतुंगसि बूदेवुंकु दंडम तासगोम.	हर रोज सुबह उठकर स्‍नान करके के पृथ्‍वी को नमन करनी चाहिये।	రోజు స్నానం చేసి ప్రొద్దున భూమాతకు దండం పెట్టుతారు.
नर्सबाई दंडक सूदी वाटंता.	नर्स हमेशा इंजेक्‍शन बाजूंओ में लगाती है।	
राणी राजांक रोज नमस्‍कारम कींता.	रानी रोज राजा को प्रणाम करती है।	రాణి రాజుకు వందనం చేసింది.
नुल्‍लें कस्‍कुतंका गॊक्‍ते इरगा दद्दुक तेदंता.		దోమలు కుట్టితే శరీరమంత పొక్కులు వస్తాయి.
नावा कादुक बंडा दल्‍गुता.	मेरे पैर को पत्‍थर का ठेस लगा।	
गोडकुन दामीडते दोहंतुर.		ఆవులను తలుగులతొ కట్టుతారు.
लॊता मुन्ने दारा मनंता		ఇంటిలో ముందు స్థలాన్ని వాకిలి అంటారు.
मना देशमकु नालूं दिक्‍कुल्‍कु मंतां, तूरपु, दक्षिणा,उत्तेरा,पडमटा.		మాన దేశనికి నాలుగు దిక్కులున్నాయి, తూర్పు, పడమర, ఉత్తరం, ధక్షిణ.
मावा कचलम बुर्दते दिगा बडता.	हमारी खटारा कीचड़ में फंस गया।	
मातरल दुड्डु पीसि ताकंतोर.		ముసలివాడు కట్టే సహయముతో నడుస్తారు.
नना मरा पोरोटाल दुन्‍कुसेके मंतन.	मै पेड़ के ऊपर से खुद र‍हा हू।	నేను ఎగురు చున్నాను.
वडी,पिर्रु,दुब्‍बा,दूली अन्नि कलियसि वाते, दान दुमारम इंतुर.	हवा, पानी, धूल यह सब जब एक साथ आता है, तो उसे तुफान कहते है।	ఉరుములు, మెరుపులు వాన, జోరుగా ఉన్న దానిని తుఫాన్ అంటారు.
कोत्तां तच्‍चि मल्‍सि हिय्यकोंटे ओन लंगाल इंतुर.	बे वजह तकलीफ करनेवालें को बदमाश कह जाता है।	రూపాలు తీసుకొని తిరిగి ఇవ్వని వారిని చెడ్డ వాడు అంటారు.
लॊता दूलाम्‍कु ऊकळ दोहंतुर.		ఇంటి దూలలకు ఉయ్యాల కట్టుతారు.
निन्ने नर्का मा नाटेना पाटलाना लोताल दोंगाल्‍क कोत्तां दोसकुंचि ओतुर.		దొంగలు, ఇంటి నుండి ప్లేట్లు, ముంతలు,దొసుకొనీ తీసుకెళ్ళరు.
ओना नदर ना अंङीपोरेन मंता.	उसका नज़र मेरे शर्ट पर ही है।	
इग्‍गे बोरन्ना वायानुर गिचचो नदर वाटा.	यहाँ कोई भी आ सकता है जऱा नज़र रखना।	ఇక్కడికి ఎవరైన వస్తారు నా కొరకు కొద్దిగ చూడు.
इग्‍गे बोरन्ना वायानुर गिचचो नदर वाटा.	यहाँ कोई भी आ सकता है जऱा नज़र रखना।	ఇక్కడికి ఎవరైన వస్తారు నా కొరకు కొద్దిగ చూడు.
राणी राजांक रोज नमस्‍कारम कींता.	रानी रोज राजा को प्रणाम करती है।	రాణి రాజుకు వందనం చేసింది.
नागापंचमीता नाडु नय तरासुंक पालू उहांतुर.	नाग पंचमी के दिन नाग सांप को दूध पिलाते है।	పంచిమి రోజు అందరు నాగు పామును పూజ చేస్తారు.
सिन्ने पिलाल्‍क नर्का पडिं मींडांतुर.		చిన్నలు, పెద్దలు రాత్రంత నిద్రపోతారు.
सिन्ने पिलाल्‍क नर्का पडिं मींडांतुर.		చిన్నలు, పెద్దలు రాత్రంత నిద్రపోతారు.
मा बाबल इंदके नलपै मूडु वर्सानोर आतोर.	अभी मेरे पिताजी तैंतालीस साल के है।	
गोड्डु पेय्यतुन नाकीसि बॆस कींता.	गया अपने बछड़े को चाटकर साफ करता है।	ఆవు దూడను నాకు తుంది.
नॆदुन नांगेल्ते ऊडंतुर.		చేను దున్నుటకు నాగలి పనికిస్తుంది.
ओर मनकेल मावा नाटेनोर आंदुर.	वह आदमी मेरा गांव का है।	ఆయన మా ఊరి మనిషి
ओर मनकेल मावा नाटेनोर आंदुर.	वह आदमी मेरा गांव का है।	ఆయన మా ఊరి మనిషి
लोन-लोन तिरियनोन नार तिरियनोर इंतुर.		ఇంటింటా తిరుగేవాని, అడ్డా తిరుగుడు అంటారు.
वडकला अनि रुसि हूडला नाल्‍के गावाले.		మాట్లాడుటకు, రుచికి నాలుక పనికిస్తుంది.
हक्‍केरा नास्‍ता कितीना?		ప్రొద్దున అల్పహారము చేశావా.
कटुल हिड अर्ते दान मर्रा नित्तिचंतुर.	खटिया गिरने से उसे फिर खड़ा किया जाता है।	మంచం పడితే లేపుతారు.
कटुल हिड अर्ते दान मर्रा नित्तिचंतुर.	खटिया गिरने से उसे फिर खड़ा किया जाता है।	మంచం పడితే లేపుతారు.
पेडाल सायकलतुन पकक निल्‍हाचंतोर.	बच्‍चा बाजू में खड़ा है।	పిల్లలు సైకలు ప్రకన నిలబడి ఉన్నారు.
मर्का मराता हिडु बॆसता नीडा मनंता.		మామిడి చెట్టు క్రింద మంచిగా నీడ ఉంటుంది.
हकेड्‍कु पीनी कासला होदेलतगा तडिम मासंतुर.		ప్రొద్దున పొయ్యిలో అగ్గి చేస్తారు.
ईर नलता एर निहांतोर.	यह नल का पानी भरता है।	వీరు నల్లా దగ్గర నీళ్ళు నింపుకుంటున్నారు.
कटुल्तुन नुल्‍काते हरहांतुर.		మంచంను నుల్కాతో అల్లుతారు.
नॆड़ी मराता पंडी कर्रेगा मनंता.		అల్ల నేరడి పండ్లు నల్లగా ఉంటాయి.
नॆली कियनोर नॆदगा कबड किसेके म‍ंतोर.		వ్యవసాయము చేసేవాడు మడిళ్ళలో పనిచేస్తున్నాడు.
एटीं, गोड्‍क, गोर्रें नेमर वाटंता.		ఆవులు, బఱ్ఱెలు, గొర్రెలు అని జంతువులు నెమరు వేస్తాయి.
कासुटा कंदेनाहाटीं नेरडा निय तेंडंतुर.		ఎడ్ల బండి కొరకు ద్వీపము కొరకు ఆముదము నూనే తీస్తారు.
कासुरकु रोंड नोगां मनंतां.		ఎడ్ల బండికి, రెండు పోడుగాటి కట్టెలు ఉంటాయి.
नाकु नोंडे नोटा वांता.		జనుమలో తాడు అల్లుతారు.
मरमीना पेडन नोव्राल इंतुर.		ఇప్పుడు పెళ్ళి అయ్యె అబ్బాయిని పెండ్లి కొడుకు అంటారు.
मरमींना पेगिटुन नोव्री इंतुर.		ఇప్పుడు పెళ్ళి అయ్యె అమ్మాయిని పెండ్లి కూతురు అంటారు.
मरमींना पेगिटुन नोव्री इंतुर.		ఇప్పుడు పెళ్ళి అయ్యె అమ్మాయిని పెండ్లి కూతురు అంటారు.
उंदि कुटुंबतोर अंटोर कलियसि नोव्‍वां मोड्‍कंतुर.		ఒకే కుటుంబీకులందరు కలిసి క్రొత్త దినుసుల పండుగ చేసి తింటారు.
पंगा आयनेंके गोगोड कूसंता.	सुबह होते समय मुर्गा बांग देता है।	
पिरकालम एक्‍को पच्‍चा कुसिर कीसि तिंतुर.		గూడెలలో వర్ష కాలం వచ్చిన తరువాత ఆకు కూరలు తింటారు.
पोसकीता रंबा पंजरमते मनंता.		చిలుక పంజరంలో ఉంటుంది.
मा लोता पज्‍जो/पक्‍ककु तुम्मीर मरा मंता.		ఆయన కనిపించకుండా ఏం చేస్తున్నాడు.
इस्‍कुल पिलाल्‍क अंटोर्क नडीक पट्टा तासंतुर.	पाठशाला में सभी बच्‍चे कमर में पट्टा लगाते है।	బడి పిల్లలు చొక్క తోపల వేసి బెల్టు వేసుకుంటారు.
पट्टा हिल्‍वा जॆगातुन पडित जॆगा इंतुर.		చెట్లు, చేమ ఉండని ఆ స్థలమును పడిద్ అంటారు.
मटमते पडीं ताससि लोन वासी गाटो तिंतुर.		గుడిలలో నైవేద్యము చూపి ఇంటికి వచ్చి తింటారు.
नाकु पदिहेनी वर्साना मिय्यड मंता.	मुझे पंधरह साल की लड़की है।	
तडिम इरगा पोत्तुगोम इंचि कंट्टेन सेक्‍कां पय्‍हांतुर.		కట్టెలను మండుటకు పొయ్యిలో పెట్టుతారు.
पोलालतानाड हनमंतुना गुडिते कोब्‍बेरकाया पैहाचि पलारम तासंतुर.		పొలాల పండుగ రోజు అంజనేయునికి నైవేద్యము చూపుతారు.
अंङीता गुंडी कुटुड आतंका दारमतुन टेलर पल्‍कुने कोरकिसि नेम्‍हांतोर.		బట్టలు కుట్టె దర్జి దారమును పళ్ళతో తెంపుతాడు.
हेर्का पेडेता पल्‍कुल्‍कु पय्‍हाचि तिंतुर.		మొర్రి పండ్లను పగుల గొట్టి సారాపలుకులు తింటారు.
अंङीता गुंडी कुटुड आतंका दारमतुन टेलर पल्‍कुने कोरकिसि नेम्‍हांतोर.		బట్టలు కుట్టె దర్జి దారమును పళ్ళతో తెంపుతాడు.
मनकंक कामेल्‍क आयानय्ते ओना कळ्‍क पच्‍चगा आंता.	कावीळ से पिडित आदमी के आंखो में पिला रंग आता है।	
नाकू पसपु पच्‍चा रंग इत्ते बागा इस्‍टम.		పసుపు పసుపు పచ్చగ ఉంటుంది.
अंपुडतस्‍के एटि कोय्ते दाना उंदि तोडा कोयसि वेरे इर्रंतुर.		కార్మకాండము చేసె రోజున మేక తొడను వేరుగ ఉంచుతారు.
केडा गोर्रे पांजीते अरता.		అడవి గొఱ్ఱె వలలో పడిపోయింది.
मरमींनगा पाटडि सोनाय उह्‍कंतोर.		పెండ్లిలో ప్రధాన్ వారు సన్నాయి వాయిస్తారు.
सिना पिलाल्‍क अळ्ते ओर्कुन मगिच्‍ला पाटा पारांतुर.		అబ్బాయిలు, అమ్మయిలు పాట పాడుచున్నారు.
पाटा बंडापोरो पस्‍पू नोहकंतुर.		రుబ్బు రోలుతో పప్పును రుబ్బుతారు.
नाटुक वरोर पाटलाल मनंतोर.		ఊరికి ఒక్కక్క పటేల్ ఉంటారు.
नाटेना मुर्ताह्‍क एक्‍को पातळ कप्‍डीं पोंडंतां.		ఊళ్ళలో చాల మంది ఆడవాళ్ళు చీరలు కట్టుతారు.
पान आकी तित्ते तोड्डि एर्रगा आंता.		తమలపాకు తింటే నోరు ఎర్ర బడతుంది.
